slug,title,category,short_description,long_description,tags,seo_title,seo_description,base_price_medium_standard
krishna-flute-melody,Krishna's Flute Melody,devotional,"Lord Krishna under the peepal tree, flute in hand, lotus and peacock at dawn.","A serene devotional print of Lord Krishna playing the bansuri at sunrise — peacock feather, lotus pond, golden river. Hand-painted style, museum-grade reproduction.","krishna,devotional,bansuri,peacock,lotus,puja-room,gifting","Krishna Flute Melody — Devotional Wall Art | ChitraFrame","Framed devotional print of Lord Krishna with his flute. Premium 12×18 from ₹999. Made-to-order, ships in 3 days across India.",749
shree-ganesh-golden-aura,Shree Ganesh — Golden Aura,devotional,"Modern Ganesha on a lotus throne, golden mandala halo, deep maroon ground.","Contemporary devotional portrait of Shree Ganesh — golden aura, lotus base, intricate mandala. Auspicious for the entrance, puja room, or office wall.","ganesh,ganesha,devotional,mandala,gold,housewarming,gifting","Shree Ganesh Golden Aura — Framed Devotional Print","Premium framed print of Lord Ganesh with golden mandala. Sizes from 8×12 to 20×30. Free shipping above ₹899.",749
om-namah-shivaya-cosmic,Om Namah Shivaya — Cosmic,devotional,"Lord Shiva meditating in a cosmic galaxy, trishul beside, Om of stars.","Shiva in deep meditation, suspended in a cosmic nebula of purple and gold, Om of stars above, sacred geometry overlay. Bold devotional statement piece.","shiva,om,mahadev,trishul,cosmic,devotional,meditation","Om Namah Shivaya Cosmic — Lord Shiva Framed Art","Framed wall art of Lord Shiva in cosmic meditation. Premium 12×18 ₹999. Made-to-order, dispatched in 72 hours.",749
football-glory-moment,Football — Glory Moment,sports,"Bicycle-kick silhouette under stadium floodlights, gold confetti raining.","A cinematic football moment frozen mid-air — bicycle kick, packed stadium, gold confetti and lens flare. For the football fan's room or man-cave.","football,soccer,sports,stadium,man-cave,gifting,boys-room","Football Glory Moment — Sports Wall Art | ChitraFrame","Premium framed football print. Cinematic stadium artwork from ₹449. Free shipping above ₹899.",749
cricket-stadium-lights,Cricket — Stadium Lights,sports,"India batsman driving under the floodlights — bleed blue.","Iconic cricket moment under stadium lights — blue jersey, packed stands, phone lights twinkling. For every cricket-loving Indian wall.","cricket,india,sports,bleed-blue,stadium,gifting,fan","Cricket Stadium Lights — India Cricket Wall Art","Framed print of India cricket batsman under stadium lights. From ₹449. Made-to-order, ships in 3 days.",749
porsche-911-sunset-drive,Porsche 911 — Coastal Drive,automotive,"Classic Porsche 911 in gulf blue, coastal cliff road, golden sunset.","Vintage travel-poster aesthetic — classic Porsche 911 cruising the Pacific coast at sunset. Clean lines, premium framed wall art for car enthusiasts.","porsche,911,car,automotive,vintage,poster,gifting,man-cave","Porsche 911 Coastal Drive — Car Wall Art","Vintage-poster framed print of a Porsche 911 at sunset. Sizes from 8×12 to 20×30. Premium from ₹599.",749
midnight-lambo-neon,Midnight Lambo — Neon Tokyo,automotive,"Matte black Lamborghini on a wet Tokyo street, neon pink + cyan signs reflecting.","Cyberpunk supercar moment — matte black Lamborghini, rain-slick Tokyo street, neon pink and cyan reflections. Bold statement piece for a modern interior.","lamborghini,lambo,car,automotive,cyberpunk,neon,tokyo,gifting","Midnight Lambo Neon Tokyo — Supercar Wall Art","Cyberpunk Lamborghini framed print, Tokyo neon scene. Premium from ₹599. Made-to-order.",749
